,name,author,review,image,url_to_book
58,"Этим телом путешествовал на протяжении многих лет господин N, известный также...",Ольга Токарчук ,"         Токарчук попала ко мне руки в ассонансе с притчей Ильи Бояшова «Путь Мури», которая как нельзя лучше могла бы выступить предисловием к «Бегунам». Ведь именно перед тем, как кот Мури двинется в путь, читатель узнает, что сама философия путешествия как смысла существования обязана своими корнями древним китайским школам. «Дорога, дорога, а что ещё кроме дороги?» - спрашивает Чу Го. Ничто, кроме бесконечности странствия, отвечает Лин Пэнь.Возможно, и так. Возможно, мы действительно существуем только в тот краткий момент, когда крохотная точка на карте, подписанная «это вы», меняет свои координаты, двигается от кондиционированного аэропорта к душному автобусу и обратно. Возможно, корни - лишь атавизм диких племён, и современности приходится поспорить с концепцией домашнего уюта и пушистого пледа из Икеи.Итак, книга Токарчук - про путешествия. Больше - про движение как смысл жизни. Про то, что как только мы останавливаемся - сразу начинаем умирать и обрастать тухлым слоем плесени. Да и не книга это вовсе - скорее путеводитель по заметкам путешественников - от нескольких емких строк до фрагмента жизни человека.Нужно признать, что «Бегуны» - славная книга, когда ты сам в пути. Потому что Токарчук, видимо, лучше всех на свете умеет разговаривать на языке «надсознания». Рассказывать про зудящие, но ещё неосмысленные чувства, которые уже зародились в душе, но не нашли отпечатка слов в нейронной сетке. Иногда «Бегуны» будят в тебе клаустрофобию или натуральную истерику. Иногда просто напоминают - любое путешествие стоит того, неважно, говорим мы про некрасивую смерть Шопена или про попытку сохранить разрез человеческого тела в волшебном растворе. Консервировать мгновение.Самое сильное в мире ощущение - сильнее удушливых запахов освежителей воздуха в пригородных общественных туалетах. Когда стоишь под окнами своего дома. Когда смотришь, как загорается свет на кухне. Когда понимаешь, что ты не хочешь туда идти, а весь первобытный ужас уже давно не в темноте, схороненной за фонарями, - он в звуке домофона, подтверждающем открывшуюся дверь в подъездное ничто.В этот момент ты вспоминаешь. Люди смотрят на огромное, величественное, но не знают этому названия. Ахиллово сухожилие много лет было безымянным.  ",https://s.bookmix.ru/books/7/1/6/beguny3_1546038309.jpg,/book.phtml?id=2525469
59,Письмо возлюбленному писателю....,Франк Тилье ,"         Мой дорогой Франк Тилье, пишу тебе благодарственное письмо от всей своей души! Так я намаялась с американскими детективами - сил моих больше нет. Лишь ты - моя отрада! Твои Шарко и Энебель как тот живительный бальзам на душу! Твои сюжеты не просто расследования - а охота!Чем же порадуешь в этот раз?Что я ещё хочу сказать тебе?Кто они?Со всей любовью",https://s.bookmix.ru/books/4/8/7/sharko_6_1545379329.jpg,/book.phtml?id=2461252
60,Преступная мечта,Мишель Бюсси ,"         Во французской деревеньке Живерни (да, да, той самой, в которой жил, творил и которую прославил своими кувшинками Клод Моне) жили три женщины: девочка, молодая женщина и древняя старуха. Девочка была талантливой художницей. Молодая женщина мечтала о любви. Старуха доживала свой век.Живерни - место особое. В нем постоянно живут несколько сот человек, а ежедневно посещают тысячи, чтобы прикоснуться к творчеству великого Клода Моне, увидеть дом, где он жил, пруд с кувшинками и даже пройти мимо стога сена (пусть уже, конечно другого, но так похожего на ТОТ САМЫЙ).Вот Мишель Бюсси и приглашает своих читателей побывать там. Подробное описание деревни, её достопримечательностей, улиц, окружающих полей. И пусть главные герои книги всего лишь выдумка автора, но атмосфера особая, та, которая напитана любовью Моне. В книге много материала о жизни великого импрессиониста, его друзьях и недругах, о творчестве.Но нельзя забывать, что ""Черные кувшинки"" - это детектив. А значит, имеется в нем убийства (причем, не одно), очаровательный детектив, расследование с вытаскиванием ""скелетов из шкафов"" главных героев. Расследование необычное (впрочем, как и сами убийства) необычное, растянувшееся на долгое время. И последняя точка, поставленная в этом деле, оказывается для читателя шокирующей. Поэтому о ней тут ни-ни.""Черные кувшинки"" - это роман и о любви. Разной. Наивно-детской, безумно-извращенной, романтическо-возвышенной. Любви, пронесенной через всю жизнь. Любви, изменившей жизнь.Если ко всему сказанному добавить, что роман написан очень нестандартно (и это еще мягко сказано), события описываются от лица разных героев, представляя читателю более полную картину, погружение в действие, то скажу, что читать его мне было интересно.",https://s.bookmix.ru/books/8/1/9/chernyekuvshinki_oz_7_1548322672.jpg,/book.phtml?id=2474718
61,Город контрастов,Эдвард Резерфорд ,"         ""Париж стал интернациональным городом, и потому теперь он принадлежит всем нам – каждому человеку, живущему на Земле.""    Захватывающий и впечатляющий роман Эдварда Резерфорда ""Париж"" меня покорил. Невероятная история становления французского города от римского поселения на берегу Сены до величайшего города искусств, центра моды. ",https://s.bookmix.ru/books/2/8/8/Parizh_6288.jpg,/book.phtml?id=1876670
62,Смердящее средневековье,Никлас Натт-о-Даг ,"         Что? Говорите средневековье пару веков назад закончилось? Ну, не знаю, не знаю. Такое чувство, что в Швеции оно задержалось. И оно смердит. Воняет всё: люди — перегаром, испражнениями и выделениями; озёра — перегнивающими отбросами человеческой жизнедеятельности, сливами мануфактур и предприятий; улицы — теми же самыми отбросами... А ещё оно сочится. Оно сочится ненавистью, извращениями, болью и страхом. Все чего-то боятся. Все почувствовали на своих лицах дыхание смерти. Потому что нет ничего более дешёвого, чем человеческая жизнь в Швеции 1793 года. ",https://s.bookmix.ru/books/7/1/9/1793istoriyaodnogoubiystva_2_1539191839.jpg,/book.phtml?id=2457238
63,Между первой и второй,Генри Лайон Олди ,"         Часто вторую книгу серии ждут с таким же нетерпением, как второе произведение писателя, чей первый роман неожиданно попал в список бестселлеров. Про «синдром второго романа» написано множество книг и статей. Нам, дилетантам и диванным критикам, кажется, что нет ничего проще: и всего-то требуется от автора писать так же, как он делал в случае с первой книгой. Наверное, поэтому мы и остаёмся в категории дилетантов.Писатель Генри Лайон Олди свою вторую книгу написал давным-давно. Вторых книг циклов им тоже издано немало, так что ждать какого-либо откровения от «Беглеца» не приходилось, равно как и неожиданной авторской катастрофы. Действительно, ожидания оправдались.Вторая книга получилась точно такой же, как первая, то есть – как и остальные романы опупеи «Ойкумена». Знакомые герои, знакомые проблемы, ставший знакомым мир. Тем не менее, пытливый читатель сможет найти для себя что-то особенное в новом романе.Не утихают споры, что же такое фантастика? Это жанр или приём? Вокруг этого вопроса сломано множество копий, поэтому углубляться в него я не стану. Выскажу лишь собственное наблюдение: мир Ойкумены неотвратимо менялся на протяжении десяти лет, которые прошли с момента написания первой книги всей серии. События нашего невозможного времени откладывают свой отпечаток на автора, а следовательно – и на творчество.Итак, в центре «Беглеца» малолетний антис (как мы помним, это человек, способный выходить в космос без технических приспособлений) Натхо Сандерсон, удерживаемый научной разведкой технологически развитой расы Ларгитас. В ходе расследования феномена мальчика разведчики используют его отца Гюнтера Сандерсона, телепата-эмпата. Далее всё без затей – автор раскрывает столь популярную нынче (но от этого не менее острую и правильную) проблему взаимоотношения отца и сына. Что есть родительская любовь? Можно ли её имитировать? Можно ли воспитать её в себе по заказу? Космическая опера не была бы собой, если бы её сюжет не вращался вокруг противоборствующих обитателей Вселенной. Раса Брамайн, к которой принадлежит мать ребёнка-антиса, поклялась, что готова заплатить любую цену, чтобы «вернуть вероломно похищенного мальчика на родину». Снаряжается группа спецназа с целью проникнуть на охраняемый объект и вызволить оттуда пленника – именно любой ценой. Налицо современные веяния – то ли террористическая атака на Мумбаи, то ли операция по поимке Бен-Ладена. Не обошлось и без свойственных Олди описаний так называемой «шелухи», особого состояния транса, в которое впадают телепаты. Как всегда, эти описания нудны и затянуты, слишком красочны и в целом выпадают из динамики романа. Поэтому, увы, на отличную оценку он не тянет.Если уж вы увязли в Ойкумене, то этот роман придётся прочитать. Просто потому, что пропускать серии любимого сериала никак нельзя.  ",https://s.bookmix.ru/books/7/9/4/bludnyysynilioykumenadvadtsatletspustyakniga2beglets_0_1539480380.jpg,/book.phtml?id=2457397
64,Три круга гриппа,Франк Тилье ,"         Пандемия, Тилье - первая вещь автора в моей читательской копилке, но не первая в серии о комиссаре Шарко и о Человеке в Черном. Этот факт не мешал мне погружаться в события книги. Все отсылки к прошлым событиям автор снабдил необходимыми пояснениями.",https://s.bookmix.ru/books/4/5/3/Pandemiya_3453.jpg,/book.phtml?id=2366997
65,Немного Японии глазами русской девушки из спецслужб,Елена Звездная ,"         Знаете, как я выбираю книгу для чтения? Сперва я иду в любимый книжный, подхожу к полке с любимым автором и разглядываю книги, в поисках той, что по названию мне покажется незнакомой. Беру в руки Новинку, листаю на середину и начинаю читать.ПС. Как вы поняли, в моей рецензии ни слова о Японии и о спецслужбах. Но в целом, эта маленькая рецензия о моем впечатлении о книге. Я не претендую на перо мастера и его талант, я лишь пишу так, как велит мне сердце. Спасибо за прочтение!  ",https://s.bookmix.ru/books/8/9/7/yatvoymonstr1_1579222304.jpg,/book.phtml?id=2897604
66,"Сколько нужно киловатт, чтобы постичь душу?",Роберт Хайнлайн ,"         Книга состоит из двух линий.Восстание колонии против метрополии - дело времени. Так всегда было и всегда будет. Как на отдельной планете, так и на межпланетном уровне. Спасибо сэру Хайнлайну за то что он мастерски, в невероятно маленьких, но верных деталях, чёрточка за чёрточкой, шаг за шагом, обстоятельно показал нам революцию. Как она зарождается в представлении одного человека, как это, оказывается, сложно - рассказать об этом ещё трём, пусть и самым близким. Как сложно преодолеть реальные трудности и как ещё сложнее - воображаемые, из головы. Как идея развивается и становится чем-то осязаемым через группу людей, действительно большую - на уровне ячейки, города, страны.На мой взгляд интереснее было следить за Майкрофтом, или как его звали дальше, просто Майк. Главный управляющий компьютер, который буквально обеспечивает жизнь в тоннельной колонии: подача кислорода, вакуумная изоляция, свет, деньги, питание, связь.  История начинается с того, что сисадмин Мани и комп Майк ведут неспешную беседу через цифровой код, потом появляется цифровой голос, цифровой юмор, основанный на анализе шуток. Компьютер собрал все шутки, распечатал, а человек отмечал, какие из них считает смешными, будут ли они смешными на второй и третий раз... Между ними завязывается дружба, и я всю дорогу думала о природе этих отношений. Так и хочется, чтобы в них проскользнуло что-то человеческое, но Майк не устаёт напоминать (он же компьютер, они не устают), что он не испытывает эмоций, но может отвечать аналогично благодаря своим алгоритмам. И только к концу книги мелькнуло что-то очень-очень близкое:Это машине-то, которая всю земную литературу и научную базу за все века проанализировала мгновенно! Мне очень понравилась идея продвигать человеческие идеи, устраивать революции с помощью ИИ, который не проникаясь, собственно, человеческой сутью, приобретает человеческие черты одним лишь анализом данных. Пусть и очень сложным, пусть и на больших мощностях. Это говорит что-то о нас самих.Однажды, появится искусственный интеллект, который осилит освоение всех алгоритмов нашего поведения и  мышления. Насколько высокий процент мощности ему понадобится, чтобы достичь последнего тайного алгоритма  души?  ",https://s.bookmix.ru/books/7/6/6/Luna__surovaya_hozyajka_7766.jpg,/book.phtml?id=391983
67,Птица или пароход?,Джон Кризи ,"         В Лондоне обнаруживают тело девушки со следами удушья. В ответ на газетное объявление с просьбой помочь опознать убитую полиция получает десятки сообщений, в которых фигурируют совершенно разные фамилии,скорее всего не принадлежащие убитой, - такова нехитрая завязка романа Джона Кризи, которая обернется крайне интересным делом международного масштаба. ",https://s.bookmix.ru/books/7/5/8/taynakukaburry_oz_5_1548275988.jpg,/book.phtml?id=2472428
68,Театр Карабаса Барабаса в Гландье,Гастон Леру ,"         Если Вы любите медленное чтение в удобном кресле, тогда эта книга для Вас. Книга написана в начале прошлого столетия, а события,описываемые автором происходили еще раньше. Темп жизни был совсем другой, поэтому действие разворачивается медленно, все описания очень подробные и детализированные. Вместе с автором мы оказываемся в старом Париже и его окрестностях ,в средневековом замке Гландье  с его пристройками и  парком.          Разочаровывают поверхностные образы героев :рассеянный профессор , который даже не интересуется живущими в его доме людьми, его инфантильная дочь и ее великовозрастный жених, бабник-лесник и блудливая трактирщица, Рультабий - журналист-гений с низкой социальной ответственностью,полицейский-драматург. Все они неживые , неестественные и шаблонные.",https://s.bookmix.ru/books/4/3/1/Tajna_zheltoj_komnaty_oz_9431.jpg,/book.phtml?id=608501
69,"О вере в лучшее, когда вокруг уже хуже не может быть",Джон Харт ,"         Избитая на первый взгляд литературно-детективная тема похищения ребенка оформилась Джоном Хартом в довольно увлекательный роман с элементами мистики, магических ритуалов, с постоянным напряжением, драмой и ощущением присутствия на месте событий. История о 13-летнем мальчике Джонни, очень рано повзрослевшем после похищения его сестры-близнеца Алиссы. Не надеясь на помощь полиции, парень отправился на поиски самостоятельно. События описаны спустя год этой трагедии, когда уже отчаявшаяся мать, покинутая еще и мужем, а некогда известная красавица и умница в округе, попала под влияние местного авторитета и подсела с его помощью на наркоту и алкоголь. Сын по сути оказался без надзора и лишь один детектив Хант, расследующий это дело, беспокоился за него и понимал его как никто в городе.",https://s.bookmix.ru/books/3/1/2/posledniyrebenok0_1552272657.jpg,/book.phtml?id=2654095
