,name,author,review,image,url_to_book
84,Возвращение в волшебную страну,Д. Кэмпбелл ,"         Взрослые только притворяются, что пишут сказки для детей. Романтизм Андерсона, отголоски Первой Мировой Войны, пропитавшие строки Милна, житейская мудрость Янсен, математические шарады Кэролла, библейские аллюзии Льюиса, простые истины Экзюпери. Список можно продолжать бесконечно. Детям остаются лишь фантастические твари да места, где они обитают. Вот и мини-сериал «По ту сторону изгороди» относится к сказкам такого рода. Два брата пробираются через лес, населённый гротескными и пугающими созданиями. «Неизведанное» — вот, пожалуй, самоё точное определение этому местечку. Но весёлые песни не добавляют спокойствия, слишком уж много инфернальности у здешних обитателей. Странный дровосек, пугающий Зверь, не самые добрые колдуньи и бесконечный лес, утопающий в тумане. Уже к середине сериала у зрителя начинается вырисовываться чёткое представление о неуютной псевдореальности. И никакими песнями не задрапировать серые пейзажи чистилища. Зря, что ли, авторы изначально хотели разыграть свою пьесу в декорациях лимба? А последние серии ставят окончательные точки в трактовках образов, вознося их на непостижимо метафорический уровень. Это бегство из Неизведанного кажется невозможным, и от того более счастливым, финалом. И, прощаясь с героями, зритель оставался один на один со своими мыслями о жизни, смерти, добре, зле, страхах, наказании и прощении.Новый комикс «По ту сторону изгороди» - это очередная попытка вернуться в «Неизведанное». Почему очередная? Да потому, что порожденный странным маркетинговым коварством, комикс с идентичным названием уже выходил. Нет, это не переиздание, это совершенно новые истории. Почему так — не спрашивайте. Может быть, проявив изрядную долю изобретательности в создании волшебной страны, авторы растратили всю фантазию так, что на новое название для комикса её совсем не осталось. А может быть, как ни горько это осознавать, «По ту сторону изгороди» превратился в узнаваемый бренд (а подобные слова изрядно пропахли ремесленничеством, что уж там). И книгу с таким названием купят быстрее, нежели какое-нибудь «Назад в Неизведанное». Это не так уж плохо, но определённая магия при таком подходе пропадает. Её место занимает логика.А логика неизбежно шепчет, что повторить сериал в бумажном формате автором не получится. Ведь тот мирок был замкнутым лимбом, постепенно растворявшим сказочное, проявляя неприглядную реальность. Вернуться туда вновь — значит впасть в жуткое коматозное состояние на границе жизни и смерти. И сколько бы лазеек для различных трактовок ни оставляли нам авторы сериала, действие может происходить лишь в коротких промежутках между сериями. Так собственно и было с предыдущим сборником. Он хронологически занимал своё место в рамках сериала. Новая же книга пытается продолжить сюжетную ветку, дополнив мир маленькими необязательными подробностями. И вот мы, вслед за Грэгом (младшим из братьев), пускаемся в путешествие по следам Лягушки Героя, стараемся выжить вместе с дочерью лесника, и встречаем нового странного одноклассника в школе для зверюшек. Кажется, Неизведанное стало намного приятнее и спокойнее: здесь стало меньше тревог и пугающих встреч. Но это спокойствие обманчиво. В глубине леса всё ещё таится Зверь, а мир состоит не только из ярких радужных красок. Добро пожаловать, Алиса, в царство снов.Именно подсознательное чувство тревоги роднит комикс с сериалом. При всех своих плюсах, сценарист мультфильма злоупотреблял приёмом «перевёртывание образов». Ближе к финалу уже перестаёшь пугаться местных чудовищ, явственно осознавая их добрую сущность (кроме Зверя, естественно, должен же быть в истории антагонист). В этом плане авторы комикса работают филиграннее. Здесь играют на страхе в глазах смотрящего, но не читателя. Напуганный старший брат Вирт видит зубастых монстров во время ночного дежурства на кладбище, но по версии Грэга это всего лишь странные птица, собака и лошадь. Ну да, у птицы есть зубы, и что с того. Точно так же гномы разбегаются в разные углы при приближении гигантского кота, но, по мнению мальчика, это самое безобидное из известных животных. Нам будто бы на пальцах объясняют истины, высказанные когда-то Фрэнком Гербертом. Помните мантру Бене Гессерит, повторяемую молодым Атрейдесом во время испытания Гом-Джаббаром? «… Ибо страх убивает разум. Страх есть малая смерть, влекущая за собой полное уничтожение…» Конечно, подобные конструкции ещё слишком сложны для Грэга, и, действуя скорее по инерции, он предпочитает просто не обращать внимания на страх. Чем плох подобный метод борьбы с ночными кошмарами?Не менее интересной кажется и история «Родной край», рассказывающая о приключениях дочери лесника в формате своеобразного дневника. Оставшаяся одна в доме посреди леса, Анна коротает свои дни за домашними хлопотами, мечтая когда-нибудь вновь увидеть отца. Но если день ещё можно переждать, то после заката начинают тянуться мучительно долгие ночи. За периметром стен бродит жуткий Зверь, но даже он не так страшен, как оглушающая тишина. В такие минуты нужен кто-то рядом. И призрак умершей матери появляется очень кстати: он даёт девушке ценные советы, рассказывает о своей юности. Но реален ли он? Может это всего лишь плод разыгравшегося воображения? Ведь переизбыток женских романов в организме может дать и не такие побочные эффекты. Впрочем, вся эта история могла произойти в голове юной Анны, и на самом деле нет никакого дома в лесу. И тогда всё происходящее - не более чем метафора о взрослении девушки. Слишком уж неопределённы границы «Неизведанного», слишком уж ирреальным кажется это место.Увы, на фоне всех этих историй, сказки о школе животных нарисованные нашим соотечественником Георгием Магером, кажутся излишне детскими (и вряд ли здесь имеет место игра на контрасте). Исполненные в нарочито примитивной стилистике, они отвечают за развлечение самых юных читателей. Сами истории незатейливы: в школу приходит новый ученик и пытается завоевать симпатии одноклассников, три друга сбегают с уроков, чтобы пуститься в путешествие по реке. Подобные вещи десятками выходили во всяких мурзилках, а потому кроме как обаятельной непосредственностью ничем привлечь и не могут. Да, они чуточку расширяют мир «Неизведанного», делая его объёмнее. Но в той же мере они абсолютно необязательны. Впрочем, перед нами всё ещё сказка, а потому пусть хоть пара страниц будет без двойного дна и подстрочной философии.В итоге новый сборник «Изгороди» получился крайне неоднородным как по рисунку, так и по содержанию (и хвала «Комильфо», что они сложили разбросанные кусочки историй в единую мозаику). В нём есть история, которую хочется перечитывать, есть интересные приключения знакомых героев и парочка необязательных историй на десерт. Для тех, кому не хватило сериала и предыдущего комикса. Для тех, кто ещё не знаком с сущностью «Неизведанного». Для тех, у кого есть или будут дети. Но мы-то с вами знаем, что такие книги покупаются для того, чтобы тайно читать самим. Взрослые только притворяются, что читают сказки детям.  ",https://s.bookmix.ru/books/0/2/5/potustoronuizgoroditom11_1533522744.jpg,/book.phtml?id=2434846
85,Бодрое фэнтези для поднятия духа в трудные времена,Николас Имс ,"         Пока все читают антиутопии, постаполипсы и Камю, давайте устроим свою маленькую революцию и будем читать бодрое, жизнеутверждающее фэнтези, хоть и с изрядной долей кровищи. Но так даже веселее. Вы наверняка уже слышали множество отзывов на эту книгу. И все из них были хорошими, да? Я человек толпы и не удивлю вас своим мнением. Отличная книга! Это история ветеранов, которые волею случая снова вынуждены собрать старую банду и отправиться навстречу опасностям. Раньше они были молоды, сильны и дерзки. Теперь у них пивное пузо, больная спина и вся печаль бренного мира во взгляде. Но есть ситуации, когда отсидеться в углу не получится. Когда просто надо встать, взять меч и идти. Ну и что, что за первый день ты много не пройдешь, а меч тут же отберут разбойники. Старая банда всё преодолеет.Это самое бодрое фэнтези последнего времени. Очень много событий. Красочные боёвки. Вот я не любитель сцен боя, у меня воображение драки очень плохо выстраивает, но тут автор так постарался, что даже человек с минимальным воображением легко себе представляет мир, героев и даже мелкие детали. Написано с юмором. И это не натужные шутки, это очень уместный юмор, который ненавязчиво проходит сквозь всю историю и скрепляет её. Плюс много жизненных вопросов и нюансов. Страх, ответственность, семья, выбор между чувством и долгом, и всё это не подаётся в виде нравоучений или вещаний с вершины холма. Не знаю, как эта книга может кому-то не понравиться. Отличный кандидат для чтения в любой ситуации.  Да, еще, говорят, тут множество отсылок к рок-музыке. Названия глав и еще что-то. Но я в музыке вообще не разбираюсь, поэтому львиная доля фанатского удовольствия мимо меня прошла. Это я говорю к тому, что если вы боялись, что не поймете музыкальной темы книги и от этого история покажется вам менее интересной, не переживайте, не покажется. Она так и останется классным фэнтези с множеством приключений и хорошим юмором.  ",https://s.bookmix.ru/books/8/2/1/korolizhuti_4_1548293035.jpg,/book.phtml?id=2618657
86,Птичку жалко,Томас Харрис ,"         Похоже, не с той книги я начала знакомство с Харрисом, ой, не стой. Вернее, заочно-то я, естественно, знакома с его творчеством – ну кто же не слышал про ставшего давным-давно культовым персонажем Ганнибала Лектора? Но сам знаменитый цикл, к своему, стыду пока не читала. И вот мне, можно сказать, случайно попала в руки новинка от автора – роман «Кари Мора». Отчего же не начать именно с нее?",https://s.bookmix.ru/books/5/0/1/karimora8_1564369009.jpg,/book.phtml?id=2761579
87,Самый жирный гормон,Джейсон Фанг ,         С каких пор человечество столкнулось с проблемой ожирения? Бум произошел во второй половине 19 века. Огромное количество еды на полках. Такое доступное удовольствие. Жри не хочу. ,https://s.bookmix.ru/books/2/4/4/kodozhireniya_7_1584020861.jpg,/book.phtml?id=2930315
88,"Ты женщина, а значит ты…",Роберт Брындза ,"На что способны представительницы прекрасного пола, если их как следует разозлить? Об этом Роберт Брындза в своей книге «Ночной охотник»",https://s.bookmix.ru/books/9/6/6/nochnoyohotnik8_1514232913.jpg,/book.phtml?id=2404007
89,"Психология истеричного потребления - ""Дамское счастье"" Эмиля Золя",Эмиль Золя ,"         Это вторая книга Золя в моей жизни. В юности читала ""Жерминаль"", он произвел на меня большое впечатление, ожидала чего-то подобного, тем более, что книгу позиционировали, как лучшую у писателя. Честно говоря, разочарована. Это образчик дамского романа, где Дениза - главная героиня настолько стерильно-правильная Золушка, которая добивается всего благодаря своим добродетелям, скромности и терпению. Она настолько правильная, что  даже голодая, не опустится ни до одного сомнительного поступка. В результате живой, настоящей женщиной её не ощущаешь. В отличие от той же Катерины из ""Жерминаля"". Ей, её любви, её нравственным страданиям сопереживать у меня не получилось, они казались надуманными.Таким же ""прынцем"" из дамского романа показался и главный герой Муре - владелец огромного, как бы сейчас сказали, гипермаркета, сколотивший состояние на смелой для того времени идее вместо множества мелких лавок сосредоточить торговлю в одном гигантском магазине. Он показан беспринципным дельцом, разоряющим мелких лавочников, к женщинам относящийся с долей презрения, в общем, вместилище пороков. И под влиянием кроткой героини вдруг начинает меняться. В общем, я такое не читаю обычно, любовная история мне совершенно не зашла. А вот описание работы магазина, гибели мелкой торговли, психология дамочек, одержимых желанием покупать совершенно ненужные вещи - всё на высшем уровне. И как современно! За исключением мешков денег, конечно, который однорукий кассир каждый вечер тащил в кабинет патрона (дневная выручка). Все эти рекламные уловки применяются и теперь и мы радостно на них попадаемся. Сама недавно ездила в Сити-Град (большой торгово-развлекательный центр в Воронеже). Ехала забрать конкретную вещь, но обилие рекламы, красочно расставленные товары, море каких-то финтифлюшек, кафешек, украшений и так далее вызывает какую-то болезненную страсть тратить деньги. Не потратила только благодаря Золя, поняла, что я сейчас похожа на одну из этих парижанок, которые уже обалделые мечутся по магазину, скупая всё подряд. За это автору спасибо.Несмотря на то, что любовный сюжет книги мне не зашел, ставлю четыре. Во-первых, как не парадоксально, а захотелось ещё что-то почитать из Золя, слог у автора всё же приятный. Во-вторых, очень интересно было сравнить то время и наше. У них разве что гаджетов не было, а так людская психология не меняется.  ",https://s.bookmix.ru/books/6/2/9/damskoeschaste5_1581533809.jpg,/book.phtml?id=2919599
